{
  "schemaVersion": 1,
  "id": "sdlc-prd",
  "capability": "prd",
  "mode": "default",
  "instructions": "SKILL.md",
  "trigger": "A new project, a new user-facing or product-facing feature, or a Significant internal feature introduces a new capability.",
  "exitSignal": "A durable, identifiable, current PRD is complete, explicitly approved, and traceable through numbered requirements and acceptance criteria.",
  "evidence": [
    "The artifact identifies itself with PRD frontmatter containing a stable ID, approved status, and positive version.",
    "The PRD defines problem, target users and benefit, outcome, goals, non-goals, scenarios, numbered functional requirements and acceptance criteria, data and authority concerns, constraints, conditional success measures, open decisions, and approval evidence.",
    "Every applicable change-contract acceptance criterion maps to a numbered PRD AC identifier or is explicitly superseded with developer approval.",
    "No approval-blocking decision remains unresolved, and planning can map implementation and verification to FR and AC identifiers."
  ],
  "compatibleSdlc": ">=1.0.0 <2.0.0"
}
