{
  "schemaVersion": 1,
  "id": "sdlc-planning",
  "capability": "planning",
  "mode": "default",
  "instructions": "SKILL.md",
  "trigger": "The change is Standard or Significant.",
  "exitSignal": "A current proportional implementation and verification plan exists, including dependency-aware execution for Significant work.",
  "evidence": [
    "An inspectable current plan covers approach, affected files, sequencing, scope, verification, risk, and deferred work.",
    "The plan still matches the current change contract, authoritative design, and repository state.",
    "When a PRD is selected, the plan identifies its path, ID, approved version, and maps tasks and verification to FR and AC identifiers.",
    "A Significant plan identifies task prerequisites, consumed and produced interfaces, conservative parallel groups, and later integration work."
  ],
  "compatibleSdlc": ">=1.0.0 <2.0.0"
}
