{
  "schemaVersion": 1,
  "id": "sdlc-observability",
  "capability": "observability",
  "mode": "default",
  "instructions": "MODULE.md",
  "trigger": "A change adds, removes, or modifies logs, metrics, traces, dashboards, or alerts; introduces or changes a service, queue, scheduled-job, or other asynchronous production boundary; or has an accepted requirement for new diagnostic or operational signals.",
  "exitSignal": "Each affected production boundary and failure mode has current, queryable, privacy-safe diagnostic evidence with defined meaning and bounded cardinality or volume; applicable alerts have actionable thresholds and validated routing or are explicitly deferred as missing evidence.",
  "evidence": [
    "A signal map ties affected boundaries and important failure modes to named signals and states the diagnostic question each answers.",
    "Current output or deterministic telemetry tests prove names, fields, units, status, correlation, and failure classification at the real instrumentation boundary.",
    "Privacy evidence shows that secrets, credentials, sensitive payloads, and unnecessary personal data are excluded or transformed according to project policy.",
    "Metric and attribute cardinality is reviewed, and material log or trace volume, sampling, and retention implications are bounded.",
    "Changed alerts identify destination or owner, threshold, window, severity, response, and validated fire and no-fire behavior.",
    "Signal changes preserve or explicitly migrate dashboards, alerts, queries, and other consumers."
  ],
  "compatibleSdlc": ">=1.0.0 <2.0.0"
}
